{
  "contractVersion": "0.1.0",
  "requestId": "SYNTH-REQ-0001",
  "practitionerReference": "SYNTH-PRACTITIONER-0001",
  "pathwayCode": "routine-renewal",
  "requestedScopeReferences": [
    "SYNTH-SCOPE-001"
  ],
  "facilityOrServiceReferences": [
    "SYNTH-FACILITY-001"
  ],
  "templateVersion": "0.1.0",
  "authorityMappingVersion": "SYNTH-AUTHORITY-001",
  "evidenceManifestReference": "SYNTH-EVIDENCE-001",
  "verificationSummaryReference": "SYNTH-VERIFY-001",
  "proceduralFairnessStatus": "not-required",
  "sourcePacketHash": "aaaaaaaaaaaaaaaaaaaaaaaaaaaaaaaaaaaaaaaaaaaaaaaaaaaaaaaaaaaaaaaa",
  "temporaryApprovalExpiry": null,
  "caseClassification": "synthetic"
}
